{
  "contractVersion": "consent-authorization-case-enumeration/v1",
  "version": 1,
  "reconciliation": {
    "salvageHead": "codex/issue-6347-consent-authorization-guard",
    "salvageHeadTotal": 43,
    "retiredTotal": 24,
    "carriedTotal": 19,
    "addedTotal": 4,
    "total": 23,
    "retirementAuthority": "#6365 absorbed the runtime-kind, named-evaluation-context and disposition grammar into its committed total key partition, so every case that targeted deriveRuntimeKinds, deriveNamedEvaluationContexts or ownerContextDisposition against the version-pinned owner-context fixture is retired rather than re-hosted."
  },
  "cases": [
    "MUT-AC1-CORPUS-DROP-EXCLUDE-STANDARD",
    "MUT-AC1-CORPUS-DROP-OTHERS",
    "MUT-AC10-CORPUS-FILESYSTEM-WALK",
    "MUT-AC2-REGISTRY-DROP-ONE-SITE",
    "MUT-AC2-SCHEMA-OPEN-NESTED",
    "MUT-AC3-ANONYMOUS-ALL-TRANSPARENT",
    "MUT-AC3-OWNER-OMIT-LOCAL-OBJECT-PROPERTY",
    "MUT-AC3-RUNTIME-OMIT-ACCESSORS",
    "MUT-AC4-COMPUTED-ELEMENT-ACCESS-ONLY",
    "MUT-AC5-PREFILTER-PLAIN-ONLY",
    "MUT-AC5-PREFILTER-PLAIN-PLUS-U",
    "MUT-AC6-DIGEST-OMIT-CONSTRUCTOR",
    "MUT-AC6-DIGEST-OMIT-FILE",
    "MUT-AC6-DIGEST-OMIT-ORDINAL",
    "MUT-AC6-DIGEST-OMIT-OWNER",
    "MUT-AC6-PARTITION-NARROW-REGISTRY-HITS",
    "MUT-AC8-PARTITION-SWAP-CLASSIFICATION",
    "MUT-AC8-REASON-REMOVE-6120",
    "MUT-AC8-REGISTRY-ADD-SEVENTH",
    "MUT-ARTIFACT-COMPARE-ENVIRONMENTAL",
    "MUT-BASE-FROZEN-CONSTANT",
    "MUT-CORPUS-BIND-ANALYZED-TREE",
    "MUT-PROV-ACCEPT-UNRESOLVED"
  ],
  "carried": [
    "MUT-AC1-CORPUS-DROP-EXCLUDE-STANDARD",
    "MUT-AC1-CORPUS-DROP-OTHERS",
    "MUT-AC10-CORPUS-FILESYSTEM-WALK",
    "MUT-AC2-REGISTRY-DROP-ONE-SITE",
    "MUT-AC2-SCHEMA-OPEN-NESTED",
    "MUT-AC3-ANONYMOUS-ALL-TRANSPARENT",
    "MUT-AC3-OWNER-OMIT-LOCAL-OBJECT-PROPERTY",
    "MUT-AC3-RUNTIME-OMIT-ACCESSORS",
    "MUT-AC4-COMPUTED-ELEMENT-ACCESS-ONLY",
    "MUT-AC5-PREFILTER-PLAIN-ONLY",
    "MUT-AC5-PREFILTER-PLAIN-PLUS-U",
    "MUT-AC6-DIGEST-OMIT-CONSTRUCTOR",
    "MUT-AC6-DIGEST-OMIT-FILE",
    "MUT-AC6-DIGEST-OMIT-ORDINAL",
    "MUT-AC6-DIGEST-OMIT-OWNER",
    "MUT-AC6-PARTITION-NARROW-REGISTRY-HITS",
    "MUT-AC8-PARTITION-SWAP-CLASSIFICATION",
    "MUT-AC8-REASON-REMOVE-6120",
    "MUT-AC8-REGISTRY-ADD-SEVENTH"
  ],
  "added": [
    "MUT-ARTIFACT-COMPARE-ENVIRONMENTAL",
    "MUT-BASE-FROZEN-CONSTANT",
    "MUT-CORPUS-BIND-ANALYZED-TREE",
    "MUT-PROV-ACCEPT-UNRESOLVED"
  ],
  "retired": [
    "MUT-AC3-DISPOSITION-OMIT-BINARY-EXPRESSION",
    "MUT-AC3-DISPOSITION-OMIT-BINDING-ELEMENT",
    "MUT-AC3-DISPOSITION-OMIT-EXPORT-ASSIGNMENT",
    "MUT-AC3-DISPOSITION-OMIT-PARAMETER",
    "MUT-AC3-DISPOSITION-OMIT-PROPERTY-ASSIGNMENT",
    "MUT-AC3-DISPOSITION-OMIT-PROPERTY-DECLARATION",
    "MUT-AC3-DISPOSITION-OMIT-SHORTHAND-PROPERTY-ASSIGNMENT",
    "MUT-AC3-DISPOSITION-OMIT-VARIABLE-DECLARATION",
    "MUT-AC3-NAMED-EVAL-SET-OMIT-BINARY-EXPRESSION",
    "MUT-AC3-NAMED-EVAL-SET-OMIT-BINDING-ELEMENT",
    "MUT-AC3-NAMED-EVAL-SET-OMIT-EXPORT-ASSIGNMENT",
    "MUT-AC3-NAMED-EVAL-SET-OMIT-PARAMETER",
    "MUT-AC3-NAMED-EVAL-SET-OMIT-PROPERTY-ASSIGNMENT",
    "MUT-AC3-NAMED-EVAL-SET-OMIT-PROPERTY-DECLARATION",
    "MUT-AC3-NAMED-EVAL-SET-OMIT-SHORTHAND-PROPERTY-ASSIGNMENT",
    "MUT-AC3-NAMED-EVAL-SET-OMIT-VARIABLE-DECLARATION",
    "MUT-AC3-RUNTIME-SALVAGE-SUBSET",
    "MUT-AC3-RUNTIME-SET-OMIT-ARROW-FUNCTION",
    "MUT-AC3-RUNTIME-SET-OMIT-CONSTRUCTOR",
    "MUT-AC3-RUNTIME-SET-OMIT-FUNCTION-DECLARATION",
    "MUT-AC3-RUNTIME-SET-OMIT-FUNCTION-EXPRESSION",
    "MUT-AC3-RUNTIME-SET-OMIT-GET-ACCESSOR",
    "MUT-AC3-RUNTIME-SET-OMIT-METHOD-DECLARATION",
    "MUT-AC3-RUNTIME-SET-OMIT-SET-ACCESSOR"
  ]
}
